{
  "kind": "repora.posture-ci-environment",
  "version": 1,
  "repository": {
    "provider": "github",
    "full_name": "acme/fixture"
  },
  "default_branch": {
    "state": "observed",
    "value": "main",
    "evidence": [
      {
        "source": "fixture",
        "reference": "branch:main"
      }
    ]
  },
  "default_commit": {
    "state": "observed",
    "value": "abc1234",
    "evidence": [
      {
        "source": "fixture",
        "reference": "commit:abc1234"
      }
    ]
  },
  "profile_declared": {
    "state": "observed",
    "value": true,
    "evidence": [
      {
        "source": "fixture",
        "reference": ".repora/posture-ci-environment.yaml"
      }
    ]
  },
  "declared_applicability": {
    "state": "observed",
    "value": "not-applicable",
    "evidence": [
      {
        "source": "fixture",
        "reference": ".repora/posture-ci-environment.yaml"
      }
    ]
  },
  "flake_present": {
    "state": "observed",
    "value": false,
    "evidence": [
      {
        "source": "fixture",
        "reference": "tree:flake.nix"
      }
    ]
  },
  "flake_lock_present": {
    "state": "observed",
    "value": false,
    "evidence": [
      {
        "source": "fixture",
        "reference": "tree:flake.lock"
      }
    ]
  },
  "workflows_state": "observed",
  "workflows": [],
  "external_inputs": [],
  "evidence": [
    {
      "source": "fixture",
      "reference": "fixture-root"
    }
  ]
}
